Name,Location,State(s),Counties,Type,Length,Uses
Idaho Giant Cedar,"11 miles north of Elk River, ID.",Idaho,Clearwater,['Backcountry'],0.50 Miles / 0.80 Km,"['Bicycling (on pavement)', 'Bicycling (off pavement)', 'Dogs - On leash', 'Pedestrian - Walking/Hiking/Running', 'Snow - Cross-country Skiing', 'Snow - Snowshoeing', 'Wildlife Observation']"
Illinois Prairie Path,"3-branched system joining Aurora, Elgin, and Oak Park, with junction in Wheaton.",Illinois,"Dupage, Kane, Cook","['Rail', 'Trail']",27.80 Miles / 44.74 Km,"['Bicycling (on pavement)', 'Bicycling (off pavement)', 'Dogs - On leash', 'Equestrian - Riding', 'Pedestrian - Walking/Hiking/Running', 'Roller/Inline Skating', 'Skateboarding', 'Snow - Cross-country Skiing', 'Snow - Snowshoeing', 'Wildlife Observation']"
Inaja Memorial Nature,N of Payson on SR 87 18 mi. at a point on along the Mogollon Rim.  Turn right into the trailhead.  Also accessible from SR 260 at milepost 279.,California,San Diego,[],1.00 Miles / 1.61 Km,"['Dogs - On leash', 'Pedestrian - Walking/Hiking/Running']"
Indian Nations,"At Hochatown State Park, follows west shoreline of Broken Bow Lake.",Oklahoma,,[],20.00 Miles / 32.19 Km,[]
Interloken NRT,"Finger Lakes National Forest, Follows the Hector Backbone between Cayuga and Seneca Lake, c. 15 mi. northwest of Ithaca.",New York,"Seneca, Schuyler",['Backcountry'],12.00 Miles / 19.31 Km,"['Camping', 'Camping', 'Equestrian - Riding', 'Fishing', 'Motorized vehicles - Snowmobiling', 'Pedestrian - Walking/Hiking/Running', 'Snow - Cross-country Skiing', 'Snow - Snowshoeing']"
Iron Mtn. Trail #242/Cascade Falls Trail #242-A,"16 miles south of Plains, MT., In Lolo National Forest, 14 SE of Plains on Forest Hwy 135 at Cascade Campground.<br/>",Montana,Sanders,[],1.20 Miles / 1.93 Km,"['Bicycling (on pavement)', 'Bicycling (off pavement)', 'Camping', 'Camping', 'Dogs - On leash', 'Pedestrian - Walking/Hiking/Running', 'Shooting - Archery', 'Snow - Cross-country Skiing', 'Snow - Snowshoeing']"
J. Clark Salyer Canoe Trail,"At J. Clark Salyer NWR, NE of Minot, off State Route 14.",North Dakota,Ward,"['Nature', 'Trail', 'Water', 'Trail']",13.00 Miles / 20.92 Km,"['Boating, non-motorized: Canoeing', 'Boating, non-motorized: Kayaking', 'Pedestrian - Walking/Hiking/Running']"
Jack-O-Lantern Branch Heritage Trail,At Booker T. Washington Nat. Monument E of Burnt Chimney on SR 122.<br/>,Virginia,,[],1.50 Miles / 2.41 Km,[]
Jackass Ridge Snowmobile,"In Coeur d’Alene NF, 5 trailheads near I-90, NE of Kellogg.",Idaho,Shoshone,[],31.00 Miles / 49.89 Km,[]
Jackson,"S and E of Munson, connects Red Rock Picnic Area to Karick Lake.",Florida,,[],21.00 Miles / 33.80 Km,"['Camping', 'Camping', 'Dogs - On leash', 'Motorized vehicles - ATV riding', 'Pedestrian - Walking/Hiking/Running', 'Wildlife Observation']"
Jacobus Park Nature Trail,"Jacobus Park, 6501 W. Hillside Ln. Wauwatosa, WI, At Jacobus Park in Wawautosa south side of Menominee River between Hawley Road and north 68th Street.<br/>",Wisconsin,Milwaukee,"['Nature', 'Trail']",0.90 Miles / 1.45 Km,['Pedestrian - Walking/Hiking/Running']
Jedediah Smith,E Along American River Greenway from Sacramento to Folsom.,California,Sacramento,[],26.00 Miles / 41.84 Km,[]
Jenny Wiley,"Connects Jenny Wiley State Park N to Ohio River crossing US 23 at both ends, with other crossings at US 460, SR 172, SR J, US 60, I-64, and State Route 253. (recertified 1991)",Kentucky,,[],213.00 Miles / 342.79 Km,[]
Joe's Canyon,At Coronado Nat. Mon. near Hereford.  Trail starts 500 ft. W of visitor center.,Arizona,,[],3.10 Miles / 4.99 Km,[]
John James Audubon,"In New Orleans’ Audubon Park, SW of French Quarter.",Louisiana,,[],2.80 Miles / 4.51 Km,[]
John Wayne Pioneer Trail,Western Cascade Foothills to Ellensburg,Washington,"King, Kittitas","['Backcountry', 'Rail', 'Trail', 'Snow', 'Trail', 'Urban', 'Trail']",75.70 Miles / 121.83 Km,"['Bicycling (on pavement)', 'Bicycling (off pavement)', 'Camping', 'Dogs - Mushing', 'Dogs - On leash', 'Equestrian - Riding', 'Fishing', 'Motorized vehicles - Snowmobiling', 'Pedestrian - Walking/Hiking/Running', 'Rock Climbing', 'Snow - Cross-country Skiing', 'Snow - Downhill Skiing', 'Snow - Snow Play, General']"
Jones Gap,,South Carolina,,[],5.30 Miles / 8.53 Km,[]
Jordan River Pathway,Backcountry,Michigan,,[],18.00 Miles / 28.97 Km,"['Dogs - On leash', 'Pedestrian - Walking/Hiking/Running', 'Camping', 'Fishing', 'Snow - Snowshoeing', 'Wildlife Observation']"
Joyce Kilmer NRT #043,Chedah Rd (02) Nantahala National Forest,North Carolina,Graham,['Backcountry'],2.00 Miles / 3.22 Km,"['Pedestrian - Walking/Hiking/Running', 'Wildlife Observation']"
Junction and Breakwater Trail,"Running north-south in the southwestern side of Cape Henlopen State Park, this trail connects Lewes and Rehoboth Beach, Delaware.",Delaware,Sussex,"['Mountain', 'Bike', 'Trail', 'Nature', 'Trail', 'Rail', 'Trail']",4.00 Miles / 6.44 Km,"['Bicycling (off pavement)', 'Dogs - On leash', 'Pedestrian - Walking/Hiking/Running', 'Wildlife Observation']"
Kanatak Trail,"In Becharof National Wildlife Refuge, on the Alaska Peninsula in Southwest Alaska.  The western end of the trail begins at the southern end of Island Arm in Becharof Lake.  The trail crosses over the coastal mountains through Kanatak Pass, 1,000 feet in e",Alaska,"Lake and Peninsula Borough, Kodiak Island Borough",['Backcountry'],5.00 Miles / 8.05 Km,"['Camping', 'Fishing', 'Heritage and History', 'Hunting', 'Pedestrian - Walking/Hiking/Running', 'Wildlife Observation']"
Kaskaskia River Confluence Trail,"On  U. S. Army Corps of Engineers managed public lands at the Kaskaskia Lock and Dam site near Modoc, IL, and one hour south, south of Kaskaskia Lock and Dam along west side of Kaskaskia River at Mississippi River.<br/>",Illinois,"Modoc, Randolph","['Nature', 'Trail']",0.40 Miles / 0.64 Km,"['Bicycling (on pavement)', 'Dogs - On leash', 'Pedestrian - Walking/Hiking/Running', 'Wildlife Observation']"
Kaw River Trail,Urban/Rural,Kansas,Shawnee,"['Nature', 'Trail']",4.00 Miles / 6.44 Km,"['Bicycling (on pavement)', 'Bicycling (off pavement)', 'Camping', 'Dogs - On leash', 'Pedestrian - Walking/Hiking/Running', 'Snow - Cross-country Skiing', 'Wildlife Observation']"
Kelly Run-Pinnacle System,Along Susquehanna River at Holtwood Power Plant.,Pennsylvania,,"['Nature', 'Trail']",7.60 Miles / 12.23 Km,"['Hunting', 'Pedestrian - Walking/Hiking/Running']"
Kelsey (Scott River Rd-Paradise Lake),"At SW edge of Smith River NRA, c. 20 mi. SW of Crescent City. <br/>",California,Siskiyou,['Backcountry'],8.40 Miles / 13.52 Km,[]
King Range Trail,Above the Pacific coast near Ettersberg and Whitethorn.,California,Medocino,[],10.00 Miles / 16.09 Km,[]
Kings Highway Community Park Trail,Kings Highway Community Park,South Carolina,Sumter,['Backcountry'],2.50 Miles / 4.02 Km,"['Bicycling (on pavement)', 'Bicycling (off pavement)', 'Camping', 'Dogs - Mushing', 'Equestrian - Riding', 'Equestrian - Pack trips', 'Motorized vehicles - ATV riding', 'Motorized vehicles - Motorcycling', 'Motorized vehicles - OHV driving', 'Pedestrian - Walking/Hiking/Running', 'Roller/Inline Skating', 'Skateboarding', 'Snow - Snow Play, General', 'Wildlife Observation']"
Kings Mountain Hiking,Near Blacksburg at Kings Mountain State Park by campground shelter #3.,South Carolina,,[],17.00 Miles / 27.36 Km,[]
Kiski-Conemaugh Water Trail,"Water trail that runs from Johnstown, PA in Cambria County to Freeport, PA in Armstrong County.",Pennsylvania,"Cambria, Indiana, Westmoreland, Armstrong","['Water', 'Trail']",85.00 Miles / 136.79 Km,"['Boating, Motorized', 'Boating, non-motorized: Canoeing', 'Boating, non-motorized: Kayaking', 'Boating, non-motorized: Rafting', 'Camping', 'Fishing', 'Heritage and History', 'Swimming', 'Wildlife Observation']"
Kiwanis Trail,"Along the Rock River in Janesville, WI",Wisconsin,Rock,"['Fitness', 'Trail', 'Urban', 'Trail']",3.00 Miles / 4.83 Km,"['Bicycling (on pavement)', 'Pedestrian - Walking/Hiking/Running']"
Knob Hills Trail,"Located on the west end of Grapevine Lake, off Of State Highway 377, At west end of Grapevine Lake on State Route 377 and south on FM 1171.",Texas,Denton,['Backcountry'],5.43 Miles / 8.74 Km,"['Bicycling (off pavement)', 'Dogs - On leash', 'Pedestrian - Walking/Hiking/Running', 'Wildlife Observation']"
La Framboise Island,rural On Framboise Island in Missouri R near downtown Pierre.,South Dakota,Hughes,"['Nature', 'Trail']",7.00 Miles / 11.27 Km,['Pedestrian - Walking/Hiking/Running']
Lady Finger Bluff,north of US Highway 412 along east side of Tennessee Lake.,Tennessee,Perry,['Backcountry'],2.70 Miles / 4.35 Km,['Pedestrian - Walking/Hiking/Running']
Lake Fork,10 mi. SW of South Fork on US 160 to Lake Fork.  Trailhead NE of Lake Fork Creek.,Colorado,,[],7.10 Miles / 11.43 Km,"['Camping', 'Dogs - On leash', 'Fishing', 'Pedestrian - Walking/Hiking/Running']"
Lake Lurleen State Park Trail System,"Within Lake Lurleen State Park near Coker, in west-central Alabama.",Alabama,Tuscaloosa County,"['Backcountry', 'Mountain', 'Bike', 'Trail', 'Nature', 'Trail']",19.50 Miles / 31.38 Km,"['Bicycling (off pavement)', 'Camping', 'Dogs - On leash', 'Pedestrian - Walking/Hiking/Running', 'Swimming', 'Wildlife Observation']"
Lake Tahoe Bike and Pedestrian,"Along shoreline road  in and around Tahoe City, Along SR 28 on N and W shorelines of Lake Tahoe.",California,Placer,[],17.00 Miles / 27.36 Km,[]
Lakeshore - Idaho,"Priest Lake Ranger District, Kaniksu National Forest.",Idaho,Bonner,"['Urban', 'Trail']",7.00 Miles / 11.27 Km,"['Bicycling (on pavement)', 'Camping', 'Camping', 'Dogs - On leash', 'Equestrian - Riding', 'Equestrian - Pack trips', 'Equestrian - Other stock', 'Fishing', 'Pedestrian - Walking/Hiking/Running']"
Larry and Ronna Dykes Trail,"At Westgate Memorial Park in Dothan, AL.",Alabama,"Dothan, Houston","['Urban', 'Trail']",3.28 Miles / 5.28 Km,"['Bicycling (on pavement)', 'Dogs - On leash', 'Pedestrian - Walking/Hiking/Running']"
Laurel Highlands Hiking Trail,Rural/Backcountry,Pennsylvania,"Fayette, Somerset, Westmoreland,",[],70.00 Miles / 112.65 Km,"['Dogs - On leash', 'Camping', 'Pedestrian - Walking/Hiking/Running', 'Snow - Snowshoeing', 'Snow - Cross-country Skiing', 'Wildlife Observation', 'Camping']"
Laurel-Snow,"Highland trail about 5 mi. N of Dayton, off US 27.",Tennessee,,[],8.00 Miles / 12.87 Km,[]
Lava Cast Forest,"Deschutes National Forest, In Decshutes National Forest, S of Bend on US 97.",Oregon,Deschutes,[],0.90 Miles / 1.45 Km,[]
Lava River,"In Willamette National Forest at McKenzie Pass on SR 242, W of Sisters.<br/>
<br/>",Oregon,"Linn, Deschutes",[],0.50 Miles / 0.80 Km,[]
Lee McCune Braille,"Along Elkhorn Creek Canyon on SR 251, 10 mi. S of Casper.",Wyoming,,[],0.30 Miles / 0.48 Km,[]
Left Fork Huntington Creek,"On Manti-La Sal NF, W of Huntington above SR 31.",Utah,,['Backcountry'],5.80 Miles / 9.33 Km,"['Camping', 'Dogs - On leash', 'Fishing', 'Pedestrian - Walking/Hiking/Running']"
Lehigh Parkway Heritage,,Pennsylvania,,[],7.00 Miles / 11.27 Km,[]
Leon Creek North Greenway,Leon Creek,Texas,Bexar,"['Backcountry', 'Fitness', 'Trail', 'Greenway', 'Mountain', 'Bike', 'Trail', 'Nature', 'Trail', 'Urban', 'Trail']",13.00 Miles / 20.92 Km,"['Bicycling (on pavement)', 'Bicycling (off pavement)', 'Dogs - On leash', 'Fishing', 'Pedestrian - Walking/Hiking/Running', 'Roller/Inline Skating', 'Skateboarding', 'Wildlife Observation']"
Lewis &amp; Clark Bicentennial Trail,"Pierre/Fort Pierre, SD",South Dakota,"Hughes, Stanley","['Backcountry', 'Rail', 'Trail', 'Urban', 'Trail']",30.00 Miles / 48.28 Km,"['Bicycling (on pavement)', 'Boating, non-motorized: Canoeing', 'Boating, non-motorized: Kayaking', 'Boating, non-motorized: Rafting', 'Boating, non-motorized: Sailing', 'Camping', 'Dogs - Mushing', 'Dogs - On leash', 'Equestrian - Riding', 'Equestrian - Pack trips', 'Fishing', 'Pedestrian - Walking/Hiking/Running', 'Roller/Inline Skating', 'Snow - Cross-country Skiing', 'Snow - Snowshoeing', 'Swimming', 'Swimming - Diving/snorkeling', 'Wildlife Observation']"
Limestone County Canoe &amp; Kayak Trail,Elk River,Alabama,Limestone,"['Water', 'Trail']",21.90 Miles / 35.24 Km,"['Camping', 'Fishing', 'Swimming', 'Wildlife Observation']"
Link River Nature Trail,In Klamath Falls at the Link River Bird Sanctuary.,Oregon,Klamath,"['Nature', 'Trail']",0.80 Miles / 1.29 Km,"['Pedestrian - Walking/Hiking/Running', 'Wildlife Observation']"
Lions Park Nature Trail,"Lions Park, 4320 Lions Park Road, Temple, Texas, In Temple at Lion’s Park.<br/>
~1057 Canaan Valley Inst. Trail System WV Just east of Davis along Camp 70 Road.<br/>",Texas,Bell,['Greenway'],2.00 Miles / 3.22 Km,['Pedestrian - Walking/Hiking/Running']
Little Hole,"At Flaming Gorge National Recreation Area along Green River on US 191, 45 mi. north of Vernal.",Utah,,[],7.30 Miles / 11.75 Km,[]
Little North Fork,24 miles south west of Eureka,Montana,Lincoln,['Backcountry'],0.25 Miles / 0.40 Km,"['Dogs - On leash', 'Pedestrian - Walking/Hiking/Running', 'Wildlife Observation', 'Wildlife Observation']"
Little Stony Creek,"2.6 miles north of Dungannon, VA. on Rt 72.",Virginia,Scott,['Backcountry'],2.80 Miles / 4.51 Km,"['Camping', 'Dogs - On leash', 'Fishing', 'Pedestrian - Walking/Hiking/Running']"
Lochsa River Historic Trail,"121 miles east of Lewiston, ID. via Hwy 12.",Idaho,Idaho,['Backcountry'],16.00 Miles / 25.75 Km,"['Bicycling (on pavement)', 'Bicycling (off pavement)', 'Dogs - On leash', 'Equestrian - Riding', 'Equestrian - Pack trips', 'Equestrian - Other stock', 'Pedestrian - Walking/Hiking/Running', 'Snow - Cross-country Skiing', 'Snow - Snowshoeing', 'Wildlife Observation']"
Lone Star,"In San Jacinto-Sam Houston National Forest, connects Big Creek Scenic Area to Double Creek Recreation Area.",Texas,,['Backcountry'],128.00 Miles / 206.00 Km,['Pedestrian - Walking/Hiking/Running']
Long Island Greenbelt,Suburban,New York,Suffolk,[],31.80 Miles / 51.18 Km,"['Boating, non-motorized: Canoeing', 'Camping', 'Fishing', 'Pedestrian - Walking/Hiking/Running', 'Wildlife Observation']"
Long Trail NRT,Green Mountain-Finger Lakes National Forest,Vermont,"Rutland, Addison, Washington",['Backcountry'],54.00 Miles / 86.90 Km,"['Camping', 'Camping', 'Fishing', 'Snow - Cross-country Skiing', 'Snow - Snowshoeing', 'Wildlife Observation', 'Wildlife Observation']"
Lost Bridge Hiking,5 mi. SE of Garfield on SR 127.,Arkansas,,[],0.50 Miles / 0.80 Km,[]
Lost Cabin Lake,"In Deerlodge National Forest, from Cardwell take SR 359 5 mi. to S. Boulder Road, the S 15 mi. to Bismark Reservoir.<br/>",Montana,Madison,['Backcountry'],4.00 Miles / 6.44 Km,"['Bicycling (off pavement)', 'Camping', 'Dogs - On leash', 'Equestrian - Riding', 'Equestrian - Pack trips', 'Equestrian - Other stock', 'Fishing', 'Pedestrian - Walking/Hiking/Running', 'Snow - Cross-country Skiing']"
Lost Creek,At Lake Wappapello 16 mi. NE of Poplar Bluff.,Missouri,Wayne,"['Nature', 'Trail']",1.00 Miles / 1.61 Km,"['Dogs - On leash', 'Fishing']"
Lostwood Refuge - Prairie Hiking Trail,"Lostwood Refuge, Kenmare ND, At Lostwood NWR 22 miles north of Stanley on State Route 8.<br/>",North Dakota,Burke,['Backcountry'],7.50 Miles / 12.07 Km,"['Dogs - On leash', 'Pedestrian - Walking/Hiking/Running', 'Wildlife Observation']"
Louisiana Purchase,"Brinkley, At Louisiana Purchase State Park on US 49 NW of Helena.",Arkansas,"Lee, Monroe and Phillips",[],0.20 Miles / 0.32 Km,[]
Lower Cache River Trail,Cache River State Park Natural Area,Illinois,"Johnson, Pulaski","['Nature', 'Trail', 'Water', 'Trail']",3.00 Miles / 4.83 Km,"['Boating, non-motorized: Canoeing', 'Boating, non-motorized: Kayaking', 'Pedestrian - Walking/Hiking/Running']"
Lower Trail,"16.5 mile trail located eastern terminus Alfarata (Porter Township, Huntingdon County), western terminus Flowing Springs (Frankstown Township, Blair County)",Pennsylvania,"Blair, Huntingdon","['Backcountry', 'Equestrian', 'Trail', 'Fitness', 'Trail', 'Greenway', 'Mountain', 'Bike', 'Trail', 'Nature', 'Trail', 'Rail', 'Trail']",16.50 Miles / 26.55 Km,"['Bicycling (on pavement)', 'Boating, non-motorized: Canoeing', 'Boating, non-motorized: Kayaking', 'Dogs - On leash', 'Equestrian - Riding', 'Fishing', 'Hunting', 'Pedestrian - Walking/Hiking/Running', 'Roller/Inline Skating', 'Skateboarding', 'Snow - Cross-country Skiing', 'Wildlife Observation']"
Luzerne County Rail Trail,Wilkes-Barre,Pennsylvania,Luzerne,"['Rail', 'Trail']",13.00 Miles / 20.92 Km,"['Bicycling (on pavement)', 'Boating, Motorized', 'Boating, non-motorized: Canoeing', 'Boating, non-motorized: Sailing', 'Camping', 'Dogs - On leash', 'Fishing', 'Pedestrian - Walking/Hiking/Running', 'Wildlife Observation']"
Mackenzie Touring,Access at Caberfae Ski Area west of Cadillac.,Michigan,,[],8.30 Miles / 13.36 Km,[]
Mad Creek Greenbelt,In Muscatine on Lake Park Blvd and Old Hwy. 38.,Iowa,Muscatine,['Greenway'],1.20 Miles / 1.93 Km,"['Bicycling (on pavement)', 'Pedestrian - Walking/Hiking/Running']"
Mahnomen Trail,"At Sherburne National Wildlife Refuge, east of St. Cloud, Minnesota",Minnesota,Sherburne,"['Rail', 'Trail']",3.00 Miles / 4.83 Km,"['Pedestrian - Walking/Hiking/Running', 'Wildlife Observation']"
Maidu Lake,"Winema National Forest, In Winema National Forest, 12 mi. N of Crater Lake National Park.",Oregon,Klamath,['Backcountry'],2.00 Miles / 3.22 Km,"['Bicycling (on pavement)', 'Bicycling (off pavement)', 'Camping', 'Camping', 'Dogs - Mushing', 'Dogs - On leash', 'Equestrian - Riding', 'Equestrian - Pack trips', 'Equestrian - Other stock', 'Fishing', 'Pedestrian - Walking/Hiking/Running']"
Malheur River,In Malheur National Forest along the Malheur River northwest of Drewsey.,Oregon,Grant,['Backcountry'],8.00 Miles / 12.87 Km,"['Camping', 'Dogs - On leash', 'Equestrian - Riding', 'Fishing', 'Pedestrian - Walking/Hiking/Running', 'Swimming']"
"Marc Dupuy, Jr. Wildlife Trail","Grand Cote National Wildlife Refuge, northwest of Marksville, LA",Louisiana,Avoyelles Parish,[],0.50 Miles / 0.80 Km,"['Dogs - On leash', 'Pedestrian - Walking/Hiking/Running', 'Wildlife Observation']"
Marjorie Harris Carr Cross Florida Greenway,North Central Florida,Florida,"Citrus, Levy, Marion, Putnam",[],110.00 Miles / 177.03 Km,"['Bicycling (on pavement)', 'Dogs - On leash', 'Pedestrian - Walking/Hiking/Running']"
Mary Ingles Trail System,"Yatesville Lake State Park, Louisa, KY",Kentucky,Lawrence,['Backcountry'],3.50 Miles / 5.63 Km,"['Bicycling (on pavement)', 'Bicycling (off pavement)', 'Dogs - On leash', 'Fishing', 'Pedestrian - Walking/Hiking/Running', 'Swimming', 'Swimming - Diving/snorkeling', 'Wildlife Observation']"
Massanutten Trail,"North end of historic Massanutten Mountain; George Washington &amp; Jefferson National Forests, Lee Ranger District, VA",Virginia,Page &amp; Shenandoah,['Backcountry'],71.00 Miles / 114.26 Km,"['Bicycling (on pavement)', 'Bicycling (off pavement)', 'Camping', 'Dogs - On leash', 'Equestrian - Riding', 'Equestrian - Pack trips', 'Equestrian - Other stock', 'Pedestrian - Walking/Hiking/Running', 'Snow - Cross-country Skiing', 'Snow - Snow Play, General', 'Snow - Snowshoeing', 'Swimming', 'Wildlife Observation']"
Matsell Bridge,NE of Cedar Rapids . 3 mi. N of Viola.,Iowa,Linn,['Greenway'],8.40 Miles / 13.52 Km,"['Bicycling (on pavement)', 'Pedestrian - Walking/Hiking/Running']"
McDaniel Farm Park Trails,"Gwinnett County Parks &amp; Recreation, McDaniel Farm Park, 3251 McDaniel Road, Duluth, GA 30096",Georgia,Gwinnett,"['Nature', 'Trail', 'Urban', 'Trail']",2.30 Miles / 3.70 Km,"['Bicycling (on pavement)', 'Dogs - On leash', 'Heritage and History', 'Pedestrian - Walking/Hiking/Running', 'Wildlife Observation']"
McKenzie River Trail,follows upper McKenzie River along SR 126,Oregon,"Lane, Linn",['Backcountry'],25.90 Miles / 41.68 Km,"['Bicycling (off pavement)', 'Camping', 'Dogs - On leash', 'Pedestrian - Walking/Hiking/Running']"
Meadow Creek Trail #726,"Nez Perce National Forest; Slim<apos>s Camp Trailhead, approximately one mile up Meadow Creek at its confluence with the Selway River.</apos>",Idaho,Idaho,['Backcountry'],15.00 Miles / 24.14 Km,"['Bicycling (off pavement)', 'Camping', 'Camping', 'Equestrian - Riding', 'Equestrian - Other stock', 'Fishing', 'Pedestrian - Walking/Hiking/Running']"
Medina River Greenway,"Medina River, Southern Bexar County, between Highway 16 and Pleasanton Road.",Texas,Bexar,"['Backcountry', 'Fitness', 'Trail', 'Greenway', 'Mountain', 'Bike', 'Trail', 'Nature', 'Trail']",7.00 Miles / 11.27 Km,"['Bicycling (on pavement)', 'Bicycling (off pavement)', 'Heritage and History', 'Pedestrian - Walking/Hiking/Running', 'Roller/Inline Skating', 'Wildlife Observation']"
Mendenhall Moraine Ecology Trail,"Mendenhall Glacier Recreation Area; Tongass National Forest, Starts at Mendenhall Glacier Visitor Center just west of Juneau.",Alaska,,[],1.50 Miles / 2.41 Km,"['Bicycling (on pavement)', 'Bicycling (off pavement)', 'Dogs - On leash', 'Pedestrian - Walking/Hiking/Running', 'Snow - Cross-country Skiing', 'Snow - Snowshoeing', 'Wildlife Observation', 'Wildlife Observation']"
Metacomet-Monadnock Trail,"Section 1:  Hampden and Hampshire Counties; towns of Holyoke, Easthampton, Hadley, South Hadley, Amherst and Granby, MA .  Section 2:  Franklin County;  towns of Wendell, Erving, Warwick.  Royalston, in Worc",Massachusetts,"Hampdon, Hampshire, Franklin","['Backcountry', 'Greenway']",52.20 Miles / 84.01 Km,"['Bicycling (off pavement)', 'Camping', 'Equestrian - Riding', 'Fishing', 'Motorized vehicles - Snowmobiling', 'Pedestrian - Walking/Hiking/Running', 'Snow - Cross-country Skiing', 'Snow - Snowshoeing', 'Wildlife Observation']"
Metolius-Windigo,Deschutes National Forest,Oregon,Deschutes,['Backcountry'],120.00 Miles / 193.12 Km,"['Bicycling (off pavement)', 'Camping', 'Dogs - On leash', 'Equestrian - Riding', 'Equestrian - Pack trips', 'Equestrian - Other stock', 'Fishing', 'Pedestrian - Walking/Hiking/Running']"
Middle Fork Applegate,Backcountry and Wilderness on the Rogue River-Sioskiyou National Forest southwest of Applegate Lake.   Accessed from Whiskey Creek Road at Sweaty Gulch Trail.  NOTE: bOTH BRIDGES ON THIS TRAIL HAVE BEEN DEEMED UNSAFE.  THE LOWER BRIDGE HAS BEEN REMOVED AN,California,Siskiyou,[],5.70 Miles / 9.17 Km,"['Bicycling (off pavement)', 'Camping', 'Dogs - Off leash', 'Equestrian - Riding', 'Equestrian - Pack trips', 'Fishing', 'Swimming']"
Mill Creek-Main Fork,"Salmon Challis National Forest, southeast of Patterson.",Idaho,Custer,['Backcountry'],9.00 Miles / 14.48 Km,"['Camping', 'Camping', 'Dogs - Mushing', 'Dogs - On leash', 'Equestrian - Riding', 'Equestrian - Pack trips', 'Equestrian - Other stock', 'Fishing', 'Pedestrian - Walking/Hiking/Running', 'Shooting - Archery']"
Mineral Belt Trail,"Leadville, CO",Colorado,Lake,[],12.50 Miles / 20.12 Km,[]
Mines of Spain State Recreation Area Trails System,"Mines of Spain State Recreation Area Trails System, South of Dubuque at Mines of Spain State Recreation Area.",Iowa,Dubuque,"['Backcountry', 'Nature', 'Trail', 'Snow', 'Trail']",20.00 Miles / 32.19 Km,"['Dogs - On leash', 'Fishing', 'Pedestrian - Walking/Hiking/Running', 'Snow - Cross-country Skiing']"
Minooka Park Trail System,"central Alabama, Off U.S. Highway 31 north of Jemison on County Road 146.",Alabama,Chilton,"['Backcountry', 'Nature', 'Trail']",25.00 Miles / 40.23 Km,"['Bicycling (off pavement)', 'Camping', 'Dogs - On leash', 'Equestrian - Riding', 'Fishing', 'Motorized vehicles - ATV riding', 'Motorized vehicles - Motorcycling', 'Pedestrian - Walking/Hiking/Running']"
Moab Slickrock Bike Trail,"The trail is located between Moab Valley, the gorge of the Colorado River, and the Negro Bill Canyon system.",Utah,,[],12.10 Miles / 19.47 Km,[]
Monon Greenway,"Carmel, Indiana",Indiana,Hamilton County,"['Greenway', 'Rail', 'Trail']",5.20 Miles / 8.37 Km,"['Bicycling (on pavement)', 'Dogs - On leash', 'Pedestrian - Walking/Hiking/Running', 'Roller/Inline Skating', 'Skateboarding']"
Monte Sano Nature Preserve Trail System,"Monte Sano Mountain in Huntsville, AL",Alabama,Madison,"['Greenway', 'Mountain', 'Bike', 'Trail', 'Nature', 'Trail', 'Rail', 'Trail', 'Urban', 'Trail']",20.00 Miles / 32.19 Km,"['Bicycling (off pavement)', 'Dogs - On leash', 'Heritage and History', 'Pedestrian - Walking/Hiking/Running', 'Wildlife Observation']"
Montevallo Greenway Trail,"In the City of Montevallo, in central Alabama; greenway trail connects several major area features.",Alabama,Shelby,"['Greenway', 'Nature', 'Trail']",2.00 Miles / 3.22 Km,"['Dogs - On leash', 'Pedestrian - Walking/Hiking/Running', 'Wildlife Observation']"
Montour Trail,Southwestern Pennsylivania,Pennsylvania,"Allegheny, Washington","['Rail', 'Trail']",47.00 Miles / 75.64 Km,"['Bicycling (on pavement)', 'Equestrian - Riding', 'Fishing', 'Pedestrian - Walking/Hiking/Running', 'Roller/Inline Skating', 'Snow - Cross-country Skiing']"
Morning Glory,In Yellowstone National Park at Old Faithful.,Wyoming,,[],1.50 Miles / 2.41 Km,[]
Mossy Bluff,"Greers Ferry Lake, near Greers Ferry Lake Dam.",Arkansas,Cleburne,"['Nature', 'Trail']",0.80 Miles / 1.29 Km,"['Camping', 'Dogs - On leash', 'Pedestrian - Walking/Hiking/Running', 'Swimming']"
Mount Evans,"28 miles south of Idaho Springs, CO on CO Highways 103 and 5, beginning at the parking lots at the end of CO Highway 5, near the summit of Mt. Evans.",Colorado,Clear Creek,['Backcountry'],0.17 Miles / 0.27 Km,"['Dogs - On leash', 'Pedestrian - Walking/Hiking/Running', 'Wildlife Observation']"
Mount Rogers,"At Mt. Rogers National Recreation Area, south of Chilhowie on State Route 603.",Virginia,,[],4.50 Miles / 7.24 Km,[]
Mount Taylor,"In Cibola National Forest, 20 mi. NE of Grants, access on Forest Rds. 193 and 501 off SR 547.",New Mexico,,[],4.00 Miles / 6.44 Km,[]
Mountain Laurel,,Virginia,,[],0.50 Miles / 0.80 Km,[]
