Name,Location,State(s),Counties,Type,Length,Uses
6 to 10 Trail,"At the Allegheny Portage Railroad NHS west of Altoona, PA",Pennsylvania,Blair,"['Backcountry', 'Greenway', 'Rail', 'Trail']",7.85 Miles / 12.63 Km,"['Bicycling (on pavement)', 'Bicycling (off pavement)', 'Dogs - On leash', 'Heritage and History', 'Pedestrian - Walking/Hiking/Running', 'Snow - Cross-country Skiing', 'Wildlife Observation']"
Agonikak Snowmobile,West of U.S. Highway 45 between Watersmeet and WI State line.,Michigan,Gogebic,"['Snow', 'Trail']",12.03 Miles / 19.36 Km,"['Bicycling (off pavement)', 'Dogs - Mushing', 'Equestrian - Riding', 'Motorized vehicles - Snowmobiling', 'Pedestrian - Walking/Hiking/Running', 'Snow - Cross-country Skiing', 'Snow - Snowshoeing']"
Air Line State Park Trail - South,"East Hampton, Colchester, Hebron, Lebanon",Connecticut,"New London, Tolland, Middlesex",['Greenway'],21.80 Miles / 35.08 Km,"['Dogs - On leash', 'Pedestrian - Walking/Hiking/Running']"
Alabama State Lands Bartram Canoe Trail,Located in the Mobile-Tensaw Delta in Baldwin County.,Alabama,Baldwin,"['Water', 'Trail']",154.00 Miles / 247.84 Km,"['Boating, non-motorized: Canoeing', 'Boating, non-motorized: Kayaking', 'Camping', 'Fishing', 'Heritage and History', 'Hunting', 'Swimming', 'Wildlife Observation']"
Alamosa South Bluff Trail,,Colorado,Alamosa,['Greenway'],1.80 Miles / 2.90 Km,[]
Algonkian Regional Park Sanctuary Trail,Lowe<apos>s Island</apos>,Virginia,Loudoun County,['Other'],2.00 Miles / 3.22 Km,['Wildlife Observation']
Allegheny River Trail,Franklin to Emlenton,Pennsylvania,Venango,"['Backcountry', 'Rail', 'Trail']",30.00 Miles / 48.28 Km,"['Bicycling (on pavement)', 'Camping', 'Dogs - On leash', 'Pedestrian - Walking/Hiking/Running', 'Roller/Inline Skating']"
American Tobacco Trail,"Durham &amp; Wake counties, NC",North Carolina,Durham &amp; Wake Counties,['Greenway'],10.70 Miles / 17.22 Km,"['Dogs - On leash', 'Pedestrian - Walking/Hiking/Running', 'Roller/Inline Skating']"
Anderson Road Fitness Trail,"On W side of J. Percy Priest Lake, SE of Nashville.",Tennessee,Davidson,"['Fitness', 'Trail']",1.00 Miles / 1.61 Km,"['Bicycling (on pavement)', 'Dogs - On leash', 'Fishing', 'Pedestrian - Walking/Hiking/Running', 'Swimming']"
Andy Cove Nature Trail,"In Pisgah NF, 3 mi. N of Brevard at the Pisgah Ranger Station.",North Carolina,Transylvania,"['Nature', 'Trail']",0.70 Miles / 1.13 Km,['Pedestrian - Walking/Hiking/Running']
Ankeny Rail Trail,At Ankeny NWR W of I-5 10 mi. N of Albany.,Oregon,Marion,['Backcountry'],1.00 Miles / 1.61 Km,[]
Anna Ruby,In Chattahoochee NF accessed through Unicoi SP near Robertstown on SR 75.,Illinois,Gallatin,['Backcountry'],0.80 Miles / 1.29 Km,['Pedestrian - Walking/Hiking/Running']
Annapolis Rock Hiker Campground,South Moutain State Park,Maryland,Washington,['Backcountry'],1.00 Miles / 1.61 Km,"['Camping', 'Dogs - On leash', 'Pedestrian - Walking/Hiking/Running', 'Rock Climbing', 'Wildlife Observation']"
Apalachicola Bluffs,"At Torreya SP, N of Bristol, S of I-10.",Florida,,[],0.80 Miles / 1.29 Km,[]
Apalachicola River Paddling Trail System,"Apalachicola, Florida, Water trails northeast of Apalachicola in creeks and bayous off East Bay.<br/>",Florida,Franklin,"['Water', 'Trail']",100.00 Miles / 160.93 Km,"['Boating, Motorized', 'Boating, non-motorized: Canoeing', 'Boating, non-motorized: Kayaking', 'Camping', 'Fishing', 'Pedestrian - Walking/Hiking/Running']"
Apex,"Near Golden in Apex Park, joins Heritage Square Center to the top of Lookout Mountain.",Colorado,Jefferson,[],3.30 Miles / 5.31 Km,"['Bicycling (off pavement)', 'Dogs - On leash', 'Equestrian - Riding', 'Pedestrian - Walking/Hiking/Running', 'Snow - Snowshoeing']"
Arcadia,"In Coronado National Forest, SW of Safford, accessed at Shannon and Upper Arcadia campgrounds.",Arizona,,[],6.00 Miles / 9.66 Km,[]
Arch Rock Trail,"In the Malheur NF, 25 mi. from Prairie City.  Follow SR 26, Grant Co. Rd. 18, and FS Rds. 36 and 3650.",Oregon,Grant,['Backcountry'],0.30 Miles / 0.48 Km,"['Camping', 'Dogs - On leash', 'Pedestrian - Walking/Hiking/Running']"
Arivaca Creek,East portion of Buenos Aires National Wildlife Refuge in southern Arizona,Arizona,Pima County,"['Nature', 'Trail']",1.25 Miles / 2.01 Km,"['Dogs - On leash', 'Pedestrian - Walking/Hiking/Running', 'Wildlife Observation']"
Arrowhead Trail,Peters Township,Pennsylvania,Washington,"['Rail', 'trail']",3.50 Miles / 5.63 Km,"['Bicycling (on pavement)', 'Dogs - On leash', 'Pedestrian - Walking/Hiking/Running', 'Roller/Inline Skating', 'Skateboarding', 'Snow - Cross-country Skiing', 'Snow - Snowshoeing', 'Wildlife Observation']"
Art Loeb Trail,"Pisgah Ranger District, In the Pisgah National Forest, connects Davidson River trailhead across Blue Ridge Parkway to Shining Rock Wilderness.",North Carolina,"Transylvania, Haywood",['Backcountry'],31.00 Miles / 49.89 Km,"['Camping', 'Pedestrian - Walking/Hiking/Running', 'Swimming']"
Atlantic White Cedar Swamp,At Cape Cod Nat. Seashore near S. Wellfleet at Marconi Station Site.,Massachusetts,,[],1.50 Miles / 2.41 Km,[]
Autauga Creek Canoe Trail,"Autauga County, Alabama blueway, passing south through the City of Prattville to the Alabama River.",Alabama,Autauga,"['Water', 'Trail']",13.00 Miles / 20.92 Km,"['Boating, non-motorized: Canoeing', 'Boating, non-motorized: Kayaking', 'Boating, non-motorized: Rafting', 'Camping', 'Dogs - On leash', 'Fishing', 'Heritage and History', 'Swimming']"
Badger Creek,"Backcountry/Wilderness, In the Mt. Hood National Forest, east of Mt. Hood.",Oregon,Wasco,['Backcountry'],11.00 Miles / 17.70 Km,"['Camping', 'Dogs - On leash', 'Equestrian - Riding', 'Pedestrian - Walking/Hiking/Running', 'Wildlife Observation']"
Baker Park,"Urban, Just SW of Sherman at Baker Park.",Texas,,[],1.50 Miles / 2.41 Km,[]
Bald Mountain Trail,"Just W of Ketchum, climbing Bald Mountain.",Idaho,Blaine,['Backcountry'],5.00 Miles / 8.05 Km,"['Bicycling (off pavement)', 'Pedestrian - Walking/Hiking/Running']"
Balfour Riverwalk Trail,"Bristol County, MA, Connects downtown Attleboro to Ten Mile River shoreline.",Massachusetts,Bristol,"['Greenway', 'Urban', 'Trail']",0.25 Miles / 0.40 Km,"['Bicycling (on pavement)', 'Pedestrian - Walking/Hiking/Running']"
Bandelier Backcountry,At Bandelier National Monument near Laos Alamos.,New Mexico,,[],30.00 Miles / 48.28 Km,[]
Barclay Farm Trails,"Barclay Farmstead, Cherry Hill, NJ",New Jersey,Camden,"['Nature', 'Trail']",1.00 Miles / 1.61 Km,"['Bicycling (off pavement)', 'Dogs - On leash', 'Heritage and History', 'Pedestrian - Walking/Hiking/Running', 'Snow - Cross-country Skiing', 'Snow - Snowshoeing', 'Wildlife Observation']"
Bartram Nature,"In Nantahala NF, W from Franklin to Nantahala Lake.",North Carolina,Macon,['Backcountry'],78.40 Miles / 126.17 Km,"['Camping', 'Dogs - On leash', 'Fishing', 'Pedestrian - Walking/Hiking/Running']"
Bartram Trail at Thurmond Lake,"On U.S. Army Corps of Engineers, J. Strom Thurmond Dam &amp; Lake Project, Clarks Hill, SC - Georgia side of project.",Georgia,Columbia,"['Fitness', 'Trail', 'Greenway', 'Mountain', 'Bike', 'Trail', 'Nature', 'Trail']",27.00 Miles / 43.45 Km,"['Bicycling (on pavement)', 'Bicycling (off pavement)', 'Dogs - On leash', 'Fishing', 'Heritage and History', 'Hunting', 'Pedestrian - Walking/Hiking/Running', 'Swimming', 'Wildlife Observation']"
Bay de Noc - Grand Island,"Rapid River, Central Upper Peninsula of Michigan.",Michigan,"Delta, Alger",['Backcountry'],42.00 Miles / 67.59 Km,"['Bicycling (off pavement)', 'Camping', 'Camping', 'Dogs - Mushing', 'Dogs - On leash', 'Equestrian - Riding', 'Equestrian - Pack trips', 'Equestrian - Other stock', 'Snow - Cross-country Skiing']"
Beach to Bay Indian,,Maryland,,[],100.00 Miles / 160.93 Km,[]
Bear Creek Greenway,Connects five communities in Jackson County in Southern Oregon,Oregon,Jackson,['Greenway'],17.50 Miles / 28.16 Km,"['Bicycling (on pavement)', 'Dogs - On leash', 'Equestrian - Riding', 'Fishing', 'Pedestrian - Walking/Hiking/Running', 'Roller/Inline Skating', 'Skateboarding', 'Wildlife Observation']"
Bear Run Nature Reserve,,Pennsylvania,,[],20.00 Miles / 32.19 Km,[]
Bear Valley,"On Hayden Creek Rd., off SR 28, 37 mi. from Salmon.",California,Marin,[],4.20 Miles / 6.76 Km,[]
Bearaller Gap Hiking,"Near Carthage, on the north side of Cordell Hull Lake east of Tennessee 85.",Tennessee,,[],6.00 Miles / 9.66 Km,[]
Beartooth Loop,"Shoshone National Forest, Rocky Mountain Park",Wyoming,,['Backcountry'],9.70 Miles / 15.61 Km,"['Bicycling (on pavement)', 'Camping', 'Dogs - Mushing', 'Dogs - On leash', 'Equestrian - Riding', 'Equestrian - Pack trips', 'Equestrian - Other stock', 'Fishing', 'Motorized vehicles - Motorcycling', 'Motorized vehicles - Snowmobiling', 'Snow - Cross-country Skiing', 'Wildlife Observation']"
Beaver Lake Nature Center,Rural,New York,,"['Nature', 'Trail', 'Water', 'Trail']",10.00 Miles / 16.09 Km,[]
Benbrook Lake Horseback,S of Fort Worth on US 377 along W shore of Benbrook Lake.,Texas,,[],7.30 Miles / 11.75 Km,[]
Bennington Lake Trail System,"In Mill Creek Project near Walla Walla, Wa",Washington,Walla Walla,"['Equestrian', 'Trail', 'Fitness', 'Trail', 'Mountain', 'Bike', 'Trail', 'Snow', 'Trail']",20.00 Miles / 32.19 Km,"['Bicycling (on pavement)', 'Bicycling (off pavement)', 'Boating, non-motorized: Canoeing', 'Boating, non-motorized: Kayaking', 'Boating, non-motorized: Rafting', 'Boating, non-motorized: Sailing', 'Dogs - Off leash', 'Dogs - On leash', 'Equestrian - Riding', 'Fishing', 'Hunting', 'Ice Skating', 'Pedestrian - Walking/Hiking/Running', 'Roller/Inline Skating', 'Skateboarding', 'Snow - Cross-country Skiing', 'Snow - Snowshoeing', 'Swimming', 'Wildlife Observation']"
Berryman Trail,near Potosi and Steelville.,Missouri,Washington,['Backcountry'],24.00 Miles / 38.62 Km,"['Bicycling (off pavement)', 'Camping', 'Camping', 'Dogs - On leash', 'Equestrian - Riding', 'Wildlife Observation']"
Beyer Farm Trail,Warsaw,Indiana,Kosciusko,['Greenway'],23.00 Miles / 37.01 Km,[]
Big Bend Saltwater Paddling Trail,Gulf coast of Florida,Florida,"Taylor, Dixie","['Water', 'Trail']",105.00 Miles / 168.98 Km,"['Boating, non-motorized: Kayaking', 'Camping', 'Fishing', 'Heritage and History', 'Swimming', 'Swimming - Diving/snorkeling', 'Wildlife Observation']"
Big Dry Creek Trail,"Westminster, Colorado",Colorado,"Adams, Jefferson",[],9.50 Miles / 15.29 Km,[]
Big Glassy,"Suburban, Carl Sandberg Home NHS.",North Carolina,,[],1.50 Miles / 2.41 Km,[]
Big Hole Battlefield,"At Big Hole National Battlefield, ten miles west of Wisdom, MT on SH 43, In Gallatin National Forest, N of Earthquake Lake on SR 287.",Montana,Beaverhead,"['Nature', 'Trail']",0.50 Miles / 0.80 Km,['Pedestrian - Walking/Hiking/Running']
Big Springs Water,"On Henry Fork of Snake R off SR 84, ¾ mi. W of Big Springs.",Idaho,Freemont,"['Backcountry', 'Nature', 'Trail']",5.00 Miles / 8.05 Km,"['Pedestrian - Walking/Hiking/Running', 'Wildlife Observation']"
Big Wood River Trail,"Sawtooth National Forest, Ketchum Road, 3 mi. north of Ketchum, west side of State Route 75 and Big Wood River (extended 1981).",Idaho,Blaine,"['Backcountry', 'Snow', 'Trail']",2.00 Miles / 3.22 Km,"['Bicycling (on pavement)', 'Camping', 'Camping', 'Dogs - On leash', 'Equestrian - Riding', 'Equestrian - Pack trips', 'Equestrian - Other stock', 'Fishing', 'Pedestrian - Walking/Hiking/Running', 'Shooting - Archery']"
Biltmore Campus Trail,Along Highway 276 south of the Blue Ridge Parkway at the Cradle of Forestry National Forest Historic Site.,North Carolina,Transylvania,"['Nature', 'Trail']",1.00 Miles / 1.61 Km,"['Dogs - On leash', 'Pedestrian - Walking/Hiking/Running', 'Wildlife Observation']"
Bird to Gird Pathway / Indian to Girdwood Trail,"Mile 90 to Mile 103 Seward Highway, Just up above Seward Hwy, connecting Girdwood to Indian, overlooking Turnagain Arm.<br/>",Alaska,Anchorage,"['Snow', 'Trail', 'Rail', 'Trail']",13.00 Miles / 20.92 Km,"['Bicycling (on pavement)', 'Bicycling (off pavement)', 'Camping', 'Camping', 'Dogs - Mushing', 'Dogs - On leash', 'Fishing', 'Pedestrian - Walking/Hiking/Running', 'Roller/Inline Skating', 'Skateboarding']"
Black Canyon National Recreation Trail,"In both Maricopa and Yavapai Counties, north of Phoenix just west of Interstate 17 from Highway 74 north to Highway 69.  Ends at the Prescott National Forest boundary. The southern-most portion begins in Maricopa County and ends in Yavapai County.",Arizona,"Maricopa, Yavapai","['Backcountry', 'Equestrian', 'Trail', 'Mountain', 'Bike', 'Trail']",82.00 Miles / 131.97 Km,"['Bicycling (off pavement)', 'Camping', 'Dogs - On leash', 'Equestrian - Riding', 'Equestrian - Pack trips', 'Pedestrian - Walking/Hiking/Running']"
Black Creek Hiking Trail,"DeSoto National Forest, Crosses DeSoto National Forest from NW of Wiggins to Paul B. Johnson State Park SE of Hattiesburg.",Mississippi,"Forrest, Perry",['Backcountry'],40.00 Miles / 64.37 Km,[]
Black History Trail,"Washington, DC",District of Columbia,"Washington, DC",[],7.50 Miles / 12.07 Km,[]
Black River Hike and Bike Trail,"In River Road Park, near Piedmont MO, west of Piedmont on Hwy HH, north shore of Black River.",Missouri,Wayne,"['Fitness', 'Trail', 'Nature', 'Trail']",3.25 Miles / 5.23 Km,"['Bicycling (on pavement)', 'Bicycling (off pavement)', 'Dogs - On leash', 'Pedestrian - Walking/Hiking/Running']"
Blackhawk Trail,In S end of Burlington at Crapo Park. (recertified 1990),Iowa,Des Moines,"['Nature', 'Trail']",0.50 Miles / 0.80 Km,['Pedestrian - Walking/Hiking/Running']
Blacktail - Wild Bill,"Rural, 15 mi. southwest of Kalispell near Blacktail Mountain.",Montana,Lincoln,['Backcountry'],12.50 Miles / 20.12 Km,"['Motorized vehicles - ATV riding', 'Motorized vehicles - Four wheel drive', 'Motorized vehicles - Motorcycling', 'Motorized vehicles - OHV driving', 'Motorized vehicles - Snowmobiling', 'Snow - Cross-country Skiing', 'Snow - Snowshoeing']"
Blackwater Fire Memorial,"Shoshone National Forest, In Shoshone National Forest S of US 14/16, 38 mi. W of Cody at Blackwater Lodge.",Wyoming,,['Backcountry'],6.00 Miles / 9.66 Km,"['Bicycling (on pavement)', 'Camping', 'Camping', 'Dogs - Mushing', 'Dogs - On leash', 'Equestrian - Riding', 'Equestrian - Pack trips', 'Equestrian - Other stock', 'Fishing', 'Motorized vehicles - Snowmobiling']"
Blevins Gap Nature Preserve Trail System,"Huntsville, Alabama",Alabama,Madison,"['Greenway', 'Mountain', 'Bike', 'Trail', 'Nature', 'Trail', 'Urban', 'Trail']",10.50 Miles / 16.90 Km,"['Bicycling (off pavement)', 'Dogs - On leash', 'Heritage and History', 'Pedestrian - Walking/Hiking/Running', 'Wildlife Observation']"
Blue Hill Hiking Trail,"Sherburne National Wildlife Refuge, In Sherburne NWR, NW of Zimmerman, W of US 169.",Minnesota,Sherburne,"['Backcountry', 'Nature', 'Trail']",5.00 Miles / 8.05 Km,"['Pedestrian - Walking/Hiking/Running', 'Wildlife Observation']"
Blue Lake,"In Modoc National Forest, at Blue Lake Campground, 13 mi. E of Likely.",California,,[],1.50 Miles / 2.41 Km,[]
Blue Mountain Equestrian Trail,15 minutes soutwest of Missoula in the Lolo National Forest.,Montana,Missoula,['Backcountry'],9.10 Miles / 14.65 Km,"['Camping', 'Camping', 'Dogs - On leash', 'Equestrian - Riding', 'Swimming', 'Swimming - Diving/snorkeling', 'Wildlife Observation']"
Blue Ridge,"In the Apache-Sitgreaves NF from Lakeside S on SR 260, E on Bucksprings Rd, N on FS Rd. 182, W on FS Rd. 187.",Arizona,,['Backcountry'],8.70 Miles / 14.00 Km,['Pedestrian - Walking/Hiking/Running']
Bluff Trail,"13 miles SW of Walterboro, SC",South Carolina,Colleton,['Other'],3.20 Miles / 5.15 Km,['Pedestrian - Walking/Hiking/Running']
Bona Dea,On NW edge of Russellville on SR 326 (Dike Rd.).,Arkansas,,[],5.00 Miles / 8.05 Km,"['Dogs - On leash', 'Pedestrian - Walking/Hiking/Running']"
Bossard Nature,At Woodcock Creek Lake NRA 6 mi. NE of Meadville on SR 198.,Pennsylvania,,[],1.50 Miles / 2.41 Km,[]
Boulder Loop Trail,"Albany, NH, off Kancamgus Highway",New Hampshire,Carroll,['Backcountry'],2.80 Miles / 4.51 Km,"['Bicycling (off pavement)', 'Camping', 'Camping', 'Dogs - On leash', 'Pedestrian - Walking/Hiking/Running', 'Snow - Cross-country Skiing', 'Snow - Snowshoeing', 'Wildlife Observation']"
Boundary Trail,"Rogue and Siskiyou National Forests, In Siskyou National Forest. S and W of Oregon Caves NM, SE of Cave Junction.",Oregon,Josephine,['Backcountry'],15.60 Miles / 25.11 Km,"['Bicycling (off pavement)', 'Camping', 'Camping', 'Dogs - On leash', 'Equestrian - Riding', 'Equestrian - Pack trips', 'Equestrian - Other stock', 'Motorized vehicles - Motorcycling', 'Wildlife Observation']"
Brandywine Trail,"Running north-south on the eastern side of the Brandywine Creek in Brandywine Creek State Park, Delaware.",Delaware,New Castle,"['Equestrian', 'Trail', 'Mountain', 'Bike', 'Trail', 'Nature', 'Trail']",2.50 Miles / 4.02 Km,"['Bicycling (off pavement)', 'Dogs - On leash', 'Equestrian - Riding', 'Pedestrian - Walking/Hiking/Running', 'Wildlife Observation']"
Bridger Foothills,"West Bridger Mountain Range, no. of Bozeman, MT",Montana,Gallatin,['Backcountry'],20.20 Miles / 32.51 Km,"['Bicycling (off pavement)', 'Camping', 'Dogs - On leash', 'Equestrian - Riding', 'Pedestrian - Walking/Hiking/Running']"
Bronx River Blueway,The watertrail extends eight miles from Shoelace Park on East 219th Street to Soundview Park at the East River.  The Bronx River is a unique and interesting way to explore the only freshwater river in New York City.,New York,Bronx,"['Water', 'Trail', 'National', 'Water', 'Trails', 'System']",8.00 Miles / 12.87 Km,"['Boating, non-motorized: Canoeing', 'Boating, non-motorized: Kayaking']"
Brushy Creek Regional Trail &amp; Conservation Corridor,Cedar park to Round Rock,Texas,Williamson County,"['Urban', 'trail/bikeway']",3.00 Miles / 4.83 Km,"['Bicycling (on pavement)', 'Bicycling (off pavement)', 'Dogs - On leash', 'Caving']"
Bucking Mule Falls,Bighorn National Forest,Wyoming,BIg Horn,['Backcountry'],17.00 Miles / 27.36 Km,"['Bicycling (off pavement)', 'Camping', 'Dogs - On leash', 'Equestrian - Riding', 'Pedestrian - Walking/Hiking/Running']"
Buffalo Track Canyon Trail,rural,Kansas,Ellsworth,"['Nature', 'Trail']",1.50 Miles / 2.41 Km,"['Camping', 'Dogs - On leash', 'Pedestrian - Walking/Hiking/Running', 'Wildlife Observation']"
Bulls Island Wildlife,"At Cape Romain NWR, NE of Charleston.",Georgia,,[],2.00 Miles / 3.22 Km,[]
Burdette Park/University of Southern Indiana,"Burdette Park, 5301 Nurrenbern Road, Evansville, Indiana 47712 , In Evansville at Burdette Park, north of Nurrenburn Road.",Indiana,Vanderburgh,"['Nature', 'Trail']",3.00 Miles / 4.83 Km,"['Bicycling (on pavement)', 'Camping', 'Dogs - On leash', 'Heritage and History', 'Pedestrian - Walking/Hiking/Running']"
Burr Oak Nature Trail,"At Wilson Lake, just below Wilson Dam off SR 232 10 mi. N of I-70.",Kansas,Russell County,[],0.75 Miles / 1.21 Km,[]
Buttercup Valley,On slopes just north of downtown Cincinnati (recert’d 1991).,Ohio,,[],1.00 Miles / 1.61 Km,[]
Caldwell Park,"In Cincinnati’s Caldwell Park, N of downtown on North Bend Rd.",Ohio,,[],1.50 Miles / 2.41 Km,[]
California Aqueduct Bikeway,Follows I-580 and I-5 S from near Tracy to San Luis Reservoir State Recreation Area,California,Sacramento,[],67.00 Miles / 107.83 Km,[]
Callaway Gardens,At Callaway Gardens on US 27 N of Columbus. (recertified 1991),Georgia,,[],9.90 Miles / 15.93 Km,[]
Cameron Park Trails,"Waco, Texas, At Cameron Park west of Herring Avenue along south shore of Lake Brazos and the Bosque River.<br/>",Texas,McLennan,['Backcountry'],20.00 Miles / 32.19 Km,"['Dogs - On leash', 'Fishing', 'Pedestrian - Walking/Hiking/Running']"
Camp Creek,In San Bernardino National Forest on State Route 18 1 mi. east of Snow Valley Ski Area.,California,San Bernardino,[],2.20 Miles / 3.54 Km,"['Bicycling (on pavement)', 'Bicycling (off pavement)', 'Dogs - On leash', 'Fishing', 'Pedestrian - Walking/Hiking/Running', 'Wildlife Observation', 'Wildlife Observation']"
Canaan Valley Institute Trail System,"Davis, WV",West Virginia,Tucker,"['Backcountry', 'Mountain', 'Bike', 'Trail', 'Nature', 'Trail', 'Snow', 'Trail']",6.50 Miles / 10.46 Km,"['Bicycling (off pavement)', 'Camping', 'Dogs - Off leash', 'Dogs - On leash', 'Equestrian - Riding', 'Pedestrian - Walking/Hiking/Running', 'Snow - Cross-country Skiing', 'Wildlife Observation']"
Canones Creek,"In Santa Fe National Forest, 4 mi. S of Canones on Forest Rd. 99.",New Mexico,,[],12.50 Miles / 20.12 Km,[]
Cape Alava Trail,In Olympic National Park at Cape Alava near Ozette.,Washington,Jefferson,['Backcountry'],3.30 Miles / 5.31 Km,['Pedestrian - Walking/Hiking/Running']
Cardinal Greenway,East-Central Indiana,Indiana,"Wayne, Randolph, Delaware, Henry","['Greenway', 'Rail', 'Trail']",30.00 Miles / 48.28 Km,"['Bicycling (on pavement)', 'Bicycling (off pavement)', 'Equestrian - Riding', 'Pedestrian - Walking/Hiking/Running', 'Roller/Inline Skating', 'Skateboarding', 'Snow - Cross-country Skiing', 'Snow - Snowshoeing', 'Wildlife Observation']"
Caribou Ridge,"Beauty Creek Campground, Beauty Bay, east side of Lake Coeur d'Alene",Idaho,Kootenai,['Backcountry'],4.60 Miles / 7.40 Km,"['Dogs - Off leash', 'Dogs - On leash', 'Pedestrian - Walking/Hiking/Running', 'Wildlife Observation']"
Carlyle Lake Multi-Use Trail,"On U.S. Army Corps of Engineers Managed public lands at the Carlyle Lake Project and the City of Carlyle, IL. 50 miles east of St. Louis MO.",Illinois,Clinton,"['Fitness', 'Trail']",10.30 Miles / 16.58 Km,"['Bicycling (on pavement)', 'Camping', 'Dogs - On leash', 'Fishing', 'Heritage and History', 'Pedestrian - Walking/Hiking/Running', 'Roller/Inline Skating', 'Skateboarding', 'Swimming', 'Wildlife Observation']"
Carson Emigrant Historic,Caples Lake Dam parking area.,California,El Dorado,['Backcountry'],15.00 Miles / 24.14 Km,"['Camping', 'Motorized vehicles - Snowmobiling', 'Pedestrian - Walking/Hiking/Running']"
Cascade Falls,"Cedar City Ranger District, In Dixie, 35 mi. SE of Cedar City, off SR 14 on Dry Valley Rd.",Utah,Kane,['Backcountry'],0.50 Miles / 0.80 Km,"['Dogs - On leash', 'Pedestrian - Walking/Hiking/Running', 'Wildlife Observation', 'Wildlife Observation']"
Cascades,"NE of Pearisburg, at N end of county rd. 623.",Virginia,Giles,['Backcountry'],3.90 Miles / 6.28 Km,"['Dogs - On leash', 'Fishing']"
Cason J Gallaway,At Cason J. Callaway Memorial Forest just W of Hamilton. (recertified 1991)<br/>,Georgia,,[],8.00 Miles / 12.87 Km,[]
Cattail Trail,West Lafayette,Indiana,Tippecanoe,"['Greenway', 'Rail', 'Trail', 'Snow', 'Trail', 'Urban', 'Trail']",4.00 Miles / 6.44 Km,"['Bicycling (on pavement)', 'Bicycling (off pavement)', 'Dogs - Mushing', 'Dogs - On leash', 'Pedestrian - Walking/Hiking/Running', 'Roller/Inline Skating', 'Skateboarding', 'Snow - Cross-country Skiing', 'Wildlife Observation']"
Cedar Creek Self-Guiding Trail,"At Petit Jean SP, 18 mi. SW of Morrilton.",Arkansas,,[],1.50 Miles / 2.41 Km,[]
Cedar Falls,"Petit Jean State Park, 21 miles south of Morrillton, starts at Mather Lodge.",Arkansas,,['Backcountry'],2.20 Miles / 3.54 Km,[]
Cedar Grove Trail,In Malheur National Forest at Cedar Grove Roadless Area southwest of Mt. Vernon.,Oregon,Grant,"['Backcountry', 'Nature', 'Trail']",1.00 Miles / 1.61 Km,"['Pedestrian - Walking/Hiking/Running', 'Wildlife Observation']"
Cedar Valley Nature Trail,"Connects the Linn County Metro area to Waterloo, IA",Iowa,"Benton, Black Hawk, Buchanan, Linn","['Rail', 'Trail']",52.00 Miles / 83.69 Km,"['Bicycling (on pavement)', 'Camping', 'Dogs - On leash', 'Fishing', 'Pedestrian - Walking/Hiking/Running', 'Roller/Inline Skating', 'Snow - Cross-country Skiing', 'Snow - Snowshoeing', 'Wildlife Observation']"
Centennial Trail,"6.5 miles west of Butler, OK, On State Route 33 between Butler and Hammon.",Oklahoma,Custer,[],0.33 Miles / 0.53 Km,"['Dogs - On leash', 'Pedestrian - Walking/Hiking/Running', 'Wildlife Observation']"
Central Arizona Project (CAP)Trail,"Eastern Pima County, AZ, west and northwest of the City of Tucson (Pima County segment); east of Interstate 10.",Arizona,"Pima, Maricopa, Pinal, La Paz",[],8.00 Miles / 12.87 Km,[]
Central Park Heritage,Explores the length of Central Park in downtown Manhattan.,New York,,[],3.70 Miles / 5.95 Km,"['Bicycling (on pavement)', 'Camping', 'Camping', 'Pedestrian - Walking/Hiking/Running']"
Chattahoochee Valley Railroad (CVRR) Trail - North,Paved rail-trail within the city limits of Valley in east Alabama.,Alabama,Chambers,['Greenway'],1.40 Miles / 2.25 Km,"['Dogs - On leash', 'Pedestrian - Walking/Hiking/Running', 'Roller/Inline Skating']"
Chenango Canal Towpath Trail,From Bouckville to Elisha Payne Airport,New York,Madison,['Greenway'],6.00 Miles / 9.66 Km,"['Dogs - On leash', 'Fishing', 'Pedestrian - Walking/Hiking/Running']"
Cherry Creek,Winema National Forest,Oregon,Klamath,['Backcountry'],5.30 Miles / 8.53 Km,[]
Chichaqua Valley Trail,"Bondurant to Baxter, northeast of Des Moines, railtrail links Bondurant to Baxter.",Iowa,"Jasper, Polk","['Greenway', 'Rail', 'Trail']",20.00 Miles / 32.19 Km,"['Bicycling (on pavement)', 'Dogs - On leash', 'Pedestrian - Walking/Hiking/Running', 'Roller/Inline Skating', 'Skateboarding']"
Chicot Nature,At Chicot State Park 35 mi. S of Alexandria.,Louisiana,,[],10.20 Miles / 16.42 Km,[]
Chief Ladiga Trail (Jacksonville Section),Paved rail-trail within the city limits of Jacksonville in east-central Alabama,Alabama,Calhoun,"['Backcountry', 'Greenway', 'Nature', 'Trail', 'Rail', 'Trail']",9.00 Miles / 14.48 Km,"['Bicycling (on pavement)', 'Dogs - On leash', 'Pedestrian - Walking/Hiking/Running', 'Wildlife Observation']"
Chilco Mountain,"CDA National Forest, Fernan RD, approx.. 30 miles from Coeur d'Alene.",Idaho,"Bonner, Kootenai",[],6.40 Miles / 10.30 Km,[]
Chipmunk Rapids Cross Country Ski Trail,In the Panhandle on SR 57 22.3 mi. N of Priest River to gravel rd. 057-022.,Idaho,Bonner,[],10.40 Miles / 16.74 Km,[]
