Name,Location,State(s),Counties,Type,Length,Uses
Lehigh Canal Heritage,"Rural, Weissport.",Pennsylvania,,[],6.00 Miles / 9.66 Km,"['Bicycling (on pavement)', 'Bicycling (off pavement)', 'Boating, Canoeing', 'Camping', 'Camping', 'Dogs - On leash', 'Equestrian - Riding', 'Fishing', 'Pedestrian - Walking/Hiking/Running', 'Roller/Inline Skating']"
Lena Lake Trail,"In the Olympic NF, take Hwy 101 14 mi. N from Hoodsport to FS Rd. 25, follow in 8 mi.",Washington,"Mason, Jefferson",['Backcountry'],4.50 Miles / 7.24 Km,"['Fishing', 'Pedestrian - Walking/Hiking/Running', 'Wildlife Observation']"
Levi Wilcoxon Forest,"Rural, Ashley County.",Arkansas,,[],0.80 Miles / 1.29 Km,"['Bicycling (off pavement)', 'Dogs - On leash', 'Pedestrian - Walking/Hiking/Running', 'Wildlife Observation']"
Lewis Creek,"In Sierra NF, S from Fish Camp/Sugar Pine along SR 41.",California,Madera,[],3.70 Miles / 5.95 Km,[]
Lincoln Boyhood,Rural,Indiana,Spencer,[],1.00 Miles / 1.61 Km,"['Bicycling (on pavement)', 'Dogs - On leash', 'Pedestrian - Walking/Hiking/Running', 'Wildlife Observation']"
Linville Falls Trail,At Linville Falls on Blue Ridge Parkway at milepost 316.4.,North Carolina,,"['Backcountry', 'Nature', 'Trail']",1.20 Miles / 1.93 Km,['Pedestrian - Walking/Hiking/Running']
Little Cherry Pond,Pondicherry Division of Silvio O. Conte National Fish and Wildlife Refuge,New Hampshire,Coos,"['Backcountry', 'Nature', 'Trail']",1.00 Miles / 1.61 Km,"['Pedestrian - Walking/Hiking/Running', 'Wildlife Observation']"
Little Mulberry Park Trails,"Little Mulberry Park, Gwinnett County, Georgia",Georgia,Gwinnett,"['Equestrian', 'Trail', 'Fitness', 'Trail', 'Nature', 'Trail', 'Urban', 'Trail']",13.00 Miles / 20.92 Km,"['Bicycling (on pavement)', 'Dogs - On leash', 'Equestrian - Riding', 'Fishing', 'Heritage and History', 'Pedestrian - Walking/Hiking/Running', 'Roller/Inline Skating', 'Wildlife Observation']"
Little Pond,"Rural, At Paint Creek Lake between Chillicothe and Hillsboro on US 50. (recertified 1991)",Ohio,,[],1.50 Miles / 2.41 Km,[]
Little Tennessee River Greenway,Near Franklin follows Little Tennessee and Calllasaja Rivers.,Tennessee,Macon,['Greenway'],4.50 Miles / 7.24 Km,['Pedestrian - Walking/Hiking/Running']
Lodgepole Ski,"20 miles west of Anaconda, MT., Red Bridge Boat Launch,",Montana,"Deer Lodge, Granite","['Snow', 'Trail']",3.50 Miles / 5.63 Km,"['Snow - Cross-country Skiing', 'Snow - Snowshoeing']"
Long Creek,"Along W shore of Land Between the Lakes, just N of US 68.",Kentucky,Trigg,[],0.20 Miles / 0.32 Km,"['Dogs - On leash', 'Fishing', 'Pedestrian - Walking/Hiking/Running', 'Wildlife Observation', 'Wildlife Observation']"
Long Path through Mine Kill State Park,"Mine Kill State Park in Gilboa/North Blenheim, NY to the New York Power Authority Blenheim-Gilboa Visitor Center.",New York,Schoharie,"['Backcountry', 'Nature', 'Trail', 'Snow', 'Trail']",5.00 Miles / 8.05 Km,"['Bicycling (off pavement)', 'Dogs - On leash', 'Fishing', 'Heritage and History', 'Hunting', 'Motorized vehicles - Snowmobiling', 'Pedestrian - Walking/Hiking/Running', 'Snow - Cross-country Skiing', 'Snow - Snowshoeing', 'Wildlife Observation']"
Longleaf Trace,Hattiesburg to Prentiss,Mississippi,"Forrest, Lamar, Jefferson, Davis","['Rail', 'Trail']",41.00 Miles / 65.98 Km,"['Bicycling (on pavement)', 'Bicycling (off pavement)', 'Camping', 'Fishing', 'Pedestrian - Walking/Hiking/Running', 'Roller/Inline Skating', 'Wildlife Observation']"
Lost Cabin,"Black Elk Wilderness - Black Hills, In Black Hills National Forest, 5 mi. W of Mt. Rushmore, joins Palmer Creek and Willow Creek trailheads.",South Dakota,"Custer, Pennington",['Backcountry'],6.20 Miles / 9.98 Km,"['Camping', 'Camping', 'Dogs - Mushing', 'Dogs - On leash', 'Equestrian - Riding', 'Equestrian - Pack trips', 'Equestrian - Other stock', 'Fishing', 'Pedestrian - Walking/Hiking/Running', 'Shooting - Archery']"
Lost Coast,Access at King Range Nat. Conservation Area trailheads.,California,Humbolt,[],24.80 Miles / 39.91 Km,[]
Lost Lake Nature Trail,"N of Fresno, access from SR 145 at Friant Dam.",California,Fresno,[],1.25 Miles / 2.01 Km,[]
Louise Lake,"26 miles south of Whitehall, MT., In Deerlodge National Forest, exit I-90 at Cardwell, S on SR 359 to Forest Rd 107, up 107 14 mi.",Montana,Madison,['Backcountry'],3.50 Miles / 5.63 Km,[]
Lowell Canal Heritage,In downtown Lowell follows canal shorelines from NPS visitor center at the Mack Building.,Massachusetts,,"['Urban', 'Trail']",2.60 Miles / 4.18 Km,[]
Lower Macleay,"Forest Park, National Portland",Oregon,Multnomah,[],0.86 Miles / 1.38 Km,[]
Lumber River,"N &amp; E of Laurenburg, accessed at US 501, SR 1412, US 401, and SR 71. (recertified 1990)",North Carolina,,[],60.00 Miles / 96.56 Km,[]
Maah Daah Hey,Connects N and S units of Theodore Roosevelt NP through the Little Missouri Nat. Grasslands.  S end access at Medora on I-94; N end on US 85 S of Watford City.,North Dakota,"Billings, Golden Valley, McKenzie",['Backcountry'],96.00 Miles / 154.50 Km,[]
Mackinac Island Trail System,At Mackinac Island State Park E of Mackinac Bridge.,Michigan,,[],15.00 Miles / 24.14 Km,[]
Magnolia Trail,"St. Catherine Creek National Wildlife Refuge, Sibley MS",Mississippi,Adams,"['Nature', 'Trail']",4.50 Miles / 7.24 Km,"['Dogs - On leash', 'Pedestrian - Walking/Hiking/Running', 'Wildlife Observation', 'Wildlife Observation']"
Mahoning Shadow Trail,"Punxsutawney, Bell Twp., Young., Perry Twp., Jefferson Co., PA",Pennsylvania,"Jefferson, Indiana","['Fitness', 'Trail', 'Greenway', 'Nature', 'Trail']",15.00 Miles / 24.14 Km,"['Bicycling (on pavement)', 'Boating, non-motorized: Canoeing', 'Boating, non-motorized: Kayaking', 'Boating, non-motorized: Rafting', 'Camping', 'Fishing', 'Pedestrian - Walking/Hiking/Running', 'Roller/Inline Skating', 'Snow - Cross-country Skiing', 'Snow - Snowshoeing', 'Wildlife Observation']"
Major Fenn,"East of Kooskia at Major Fenn Picnic Area on U.S. Highway 12, 33 miles.",Idaho,Idaho,[],0.60 Miles / 0.97 Km,[]
Marble Creek NRT,"Marble Creek, ID; Panhandle National Forest",Idaho,Shoshone,['Backcountry'],26.70 Miles / 42.97 Km,"['Camping', 'Dogs - On leash', 'Equestrian - Riding', 'Equestrian - Pack trips', 'Equestrian - Other stock', 'Motorized vehicles - Motorcycling', 'Pedestrian - Walking/Hiking/Running', 'Snow - Snowshoeing', 'Wildlife Observation']"
Marden E. Cobb Waterway,"Chautauqua County Park, SW New York.",New York,,"['Water', 'Trail']",53.29 Miles / 85.76 Km,[]
Marsh Boardwalk,"At Hunting Island State Park near Beaufort, E end of US 21",South Carolina,,"['Nature', 'Trail']",0.30 Miles / 0.48 Km,['Pedestrian - Walking/Hiking/Running']
Mason-Dixon Trail,"York County Pa, along the Susquehanna River from Wrightsville to Norman Wood Bridge, Follows west shore of Susquehanna River from Wrightsville to State Route 372 bridge.",Pennsylvania,York,['Backcountry'],30.00 Miles / 48.28 Km,"['Camping', 'Pedestrian - Walking/Hiking/Running', 'Wildlife Observation']"
MassCentral Rail Trail (Northampton Section),"Located in Northampton, Mass, extending from the northern terminus of the New Haven &amp; Northampton Canal Rail Trail on the north side of downtown Northampton and extending northwesterly through Northampton and to South Main Street in Williamsburg.",Massachusetts,Hampshire,"['Greenway', 'Rail', 'Trail', 'Urban', 'Trail']",5.30 Miles / 8.53 Km,"['Bicycling (on pavement)', 'Dogs - On leash', 'Fishing', 'Pedestrian - Walking/Hiking/Running', 'Snow - Cross-country Skiing']"
May Creek,"17 miles west of Wisdom, MT; Near Elkhorn Hot Springs; Accessible from Pioneer Mountains Scenic By Way.",Montana,Beaverhead,['Backcountry'],7.00 Miles / 11.27 Km,"['Boating, Motorized', 'Camping', 'Dogs - On leash', 'Equestrian - Riding', 'Equestrian - Pack trips', 'Equestrian - Other stock', 'Motorized vehicles - Four wheel drive', 'Snow - Cross-country Skiing', 'Snow - Snowshoeing']"
McGowan National Recreation Trail,In Lassen NF 6 mi. E of Mineral on Forest Rds. 29N22 and 30N16.,California,Tehama,[],10.00 Miles / 16.09 Km,[]
McTrail,"Railtrail that connects Prickett’s Fort state park to the corner of Winfield St. and Morgantown Avenue in Fairmont, WV.",West Virginia,"Fairmont, Marion","['Nature', 'Trail', 'Rail', 'Trail']",2.50 Miles / 4.02 Km,"['Bicycling (on pavement)', 'Dogs - On leash', 'Pedestrian - Walking/Hiking/Running', 'Roller/Inline Skating', 'Skateboarding', 'Snow - Cross-country Skiing', 'Snow - Snowshoeing', 'Wildlife Observation']"
Meadowlark Trail,"Boyer Chute National Wildlife Refuge, Ft. Calhoun NE",Nebraska,Washington,"['Fitness', 'Trail', 'Nature', 'Trail']",6.00 Miles / 9.66 Km,"['Bicycling (on pavement)', 'Fishing', 'Pedestrian - Walking/Hiking/Running', 'Snow - Cross-country Skiing', 'Snow - Snowshoeing', 'Wildlife Observation']"
Memory Lane,Off US 67 at Wappapello Lake 30 Miles N of Poplar Bluff.,Missouri,Wayne,"['Fitness', 'Trail', 'Nature', 'Trail']",1.00 Miles / 1.61 Km,"['Dogs - On leash', 'Heritage and History', 'Pedestrian - Walking/Hiking/Running']"
Meta Lake,"In Mt. St. Helens Volcanic National Mon., just S of Spirit Lake on FS Rd. 99.",Washington,Skamania,"['Nature', 'Trail']",0.30 Miles / 0.48 Km,['Pedestrian - Walking/Hiking/Running']
Methuselah Trail,In Inyo NF off SR 168 15 mi. E of Big Pine.  Take Big Pine Mtn. Rd. 10 mi. to Shulman Grove.,California,Inyo,['Backcountry'],4.20 Miles / 6.76 Km,['Pedestrian - Walking/Hiking/Running']
Miccosukee Canopy Road Greenway,"Leon Couty, Florida, Alongside Miccosukee Road, east of Tallahassee to Interstate 10.",Florida,Leon,['Greenway'],20.00 Miles / 32.19 Km,"['Dogs - On leash', 'Pedestrian - Walking/Hiking/Running']"
Middle Fork Trail,Middle Fork Willamette River south of Hills Creek Reservoir. East of Oakridge.,Oregon,Lane,['Backcountry'],27.00 Miles / 43.45 Km,"['Bicycling (off pavement)', 'Equestrian - Riding', 'Pedestrian - Walking/Hiking/Running']"
Milwaukee Urban Water Trail,"Milwaukee, Menomonee, and Kinnickinnic Rivers,  Urban river trails in Milwaukee along Milwaukee, Menominee, and Kinnickinnic Rivers.<br/>",Wisconsin,"Milwaukee, Ozaukee","['Water', 'Trail']",25.00 Miles / 40.23 Km,"['Boating, non-motorized: Canoeing', 'Boating, non-motorized: Kayaking']"
Mineral Ridge,"Idaho Hwy 97, 2.5 miles south of Interstate 90, on Beauty Bay of Lake Coeur d'Alene",Idaho,Kootenai,['Backcountry'],3.30 Miles / 5.31 Km,"['Dogs - On leash', 'Pedestrian - Walking/Hiking/Running']"
Mingo Boardwalk Nature Trail,"Mingo National Wildlife Refuge, Puxico, MO, At Mingo NWR on Counyt Rd. Z, NE of Wappapello.",Missouri,Stoddard,[],1.00 Miles / 1.61 Km,['Pedestrian - Walking/Hiking/Running']
Mississippi National River and Recreation Area Water Trail,The Mississippi National River and Recreation Area offers 76 miles of river trail. 72 miles on Mississippi; 4 miles on Minnesota River. The trail begins above river mile 879 near the confluence of the Crow River  extends through Minneapolis and St. Paul t,Minnesota,"Anoka, Dakota, Hennepin, Ramsey, Washington","['Water', 'Trail', 'National', 'Water', 'Trails', 'System']",76.00 Miles / 122.31 Km,"['Boating, Motorized', 'Boating, non-motorized: Canoeing', 'Boating, non-motorized: Kayaking', 'Boating, non-motorized: Rafting']"
Mon River / Caperton / Deckers Creek Trails,"Greater Morgantown Area,  Rail-trail along east side of Monongahela River north of Fairmont from Prickett’s Fort downstream through Morgantown.<br/>",West Virginia,"Marion, Monongalia, Preston","['Greenway', 'Rail', 'Trail', 'Snow', 'Trail']",50.00 Miles / 80.47 Km,"['Bicycling (on pavement)', 'Bicycling (off pavement)', 'Boating, Motorized', 'Dogs - On leash', 'Fishing']"
Monon Rail-Trail,"Indianapolis, IN",Indiana,Marion,"['Rail', 'Trail']",7.60 Miles / 12.23 Km,"['Bicycling (on pavement)', 'Pedestrian - Walking/Hiking/Running', 'Roller/Inline Skating', 'Snow - Cross-country Skiing']"
Monte Vista Walking Trail,"Monte Vista National Wildlife Refuge, On CO 15, about 6 miles south of Monte Vista.",Colorado,Rio Grande,['Greenway'],0.50 Miles / 0.80 Km,"['Dogs - On leash', 'Pedestrian - Walking/Hiking/Running']"
Montlake Cut National Waterside Trail,"In Seattle on Hwy. 520 W take Montlake Blvd. exit, then first R on Hamlin, E to East Shelby.",Washington,King,"['Urban', 'Trail']",0.30 Miles / 0.48 Km,"['Bicycling (on pavement)', 'Dogs - On leash', 'Pedestrian - Walking/Hiking/Running']"
Moraine Hills Trail System,"Moraine Hills State Park, At Moraine Hills State Park on east side of Fox River below State Route 60.",Illinois,McHenry,"['Nature', 'Trail']",10.20 Miles / 16.42 Km,"['Dogs - On leash', 'Pedestrian - Walking/Hiking/Running', 'Roller/Inline Skating']"
Morrell Falls,"Lolo National Forest, Sec 36 T18N, In Lolo National Forest E of SR 83 above Seeley Lake.",Montana,Missoula,['Backcountry'],2.50 Miles / 4.02 Km,[]
Mount Charleston,"Mount Charleston Wilderness, In Toiyabe National Forest, NW of Las Vegas, at Cathedral Rock Picnic Area in Upper Kyle Canyon",Nevada,Clark,['Backcountry'],8.00 Miles / 12.87 Km,"['Camping', 'Camping', 'Dogs - On leash', 'Equestrian - Riding', 'Equestrian - Pack trips', 'Equestrian - Other stock', 'Pedestrian - Walking/Hiking/Running', 'Snow - Cross-country Skiing', 'Snow - Snowshoeing']"
Mount McConnel,"In the Poudre Canyon approximately 33 miles west of Fort Collins, CO on CO highway 14",Colorado,Larimer,['Backcountry'],4.00 Miles / 6.44 Km,"['Dogs - On leash', 'Pedestrian - Walking/Hiking/Running']"
Mount Si Trail,"Trail ascends the south face of Mount Si, just east of North Bend, WA.",Washington,King County,"['Backcountry', 'Nature', 'Trail']",4.00 Miles / 6.44 Km,['Pedestrian - Walking/Hiking/Running']
Mount Timpanogos Trail,"In the Uinta NF, 20 mi. NE of Provo.",Utah,Utah,['Backcountry'],18.00 Miles / 28.97 Km,['Pedestrian - Walking/Hiking/Running']
Mountains to Sea Trail,"Irvine Ranch, Orange County, Connects Irvine Ranch S through Irvine to Newport Beach.<br/>",California,Orange,"['Greenway', 'Urban', 'Trail']",22.00 Miles / 35.41 Km,"['Bicycling (on pavement)', 'Bicycling (off pavement)', 'Dogs - On leash', 'Equestrian - Riding', 'Pedestrian - Walking/Hiking/Running', 'Roller/Inline Skating', 'Swimming', 'Wildlife Observation']"
Mountains-to-Sea Trail - Falls Lake South Shore Trail Section,"Raleigh, NC, Blue<br/>
 Ridge Parkway Segment NC Follows Blue Ridge Parkway in NC then across Great Smoky Mountains National Park to Tennessee line.<br/>",North Carolina,Wake,['Backcountry'],26.00 Miles / 41.84 Km,"['Camping', 'Dogs - On leash', 'Fishing', 'Pedestrian - Walking/Hiking/Running', 'Swimming']"
Mt. Bailey,"Diamond Lake Ranger District; Umpqua National Forest, In Umpqua National Forest Diamond Lake Recreation Area on Forest Rd. 2808, SW of Diamond Lake.",Oregon,Douglas,['Backcountry'],5.00 Miles / 8.05 Km,"['Bicycling (off pavement)', 'Camping', 'Pedestrian - Walking/Hiking/Running']"
Mt. Helena Ridge,"Rocky Mountains, Trailhead in Helena at west end of Adams St, joins to Grizzly Gulch Road.",Montana,Lewis &amp; Clark,['Backcountry'],5.70 Miles / 9.17 Km,"['Bicycling (on pavement)', 'Camping', 'Camping', 'Dogs - On leash', 'Equestrian - Riding', 'Equestrian - Other stock', 'Pedestrian - Walking/Hiking/Running', 'Snow - Cross-country Skiing', 'Snow - Snowshoeing']"
Muddy Mountain Interpretive Nature Trail,Muddy Mtn. Environmental Education area,Wyoming,Natrona,[],2.00 Miles / 3.22 Km,[]
Mullet Hall Equestrian Trail System,"Former Mullet Hall Plantation, In Johns Island County Park on State Route 54, southwest of Charleston.",South Carolina,Charleston,['Backcountry'],19.00 Miles / 30.58 Km,"['Camping', 'Dogs - On leash', 'Equestrian - Riding', 'Fishing', 'Wildlife Observation', 'Wildlife Observation']"
Munising Cross Country Ski,"At Pictured Rocks NL, 3 miles from Munising on Co. Rd. H 58.",Michigan,Alger,[],11.70 Miles / 18.83 Km,[]
Muscle Shoals,Six trails at the Muscle Shoals Reservation at Wilson Dam SE of Florence. (recertified in 1992),Alabama,Colbert,[],12.00 Miles / 19.31 Km,[]
Nadeau Trail,"In Panamint Valley, Inyo County, CA; 5 miles east of Darwin, CA and 25 miles northeast of Ridgecrest, CA. West of Death Valley National Park.",California,Inyo,"['Backcountry', 'Equestrian', 'Trail', 'Fitness', 'Trail', 'Nature', 'Trail']",28.00 Miles / 45.06 Km,"['Bicycling (off pavement)', 'Camping', 'Dogs - Off leash', 'Equestrian - Riding', 'Equestrian - Pack trips', 'Heritage and History', 'Hunting', 'Motorized vehicles - ATV riding', 'Motorized vehicles - Four wheel drive', 'Motorized vehicles - Motorcycling', 'Motorized vehicles - OHV driving', 'Pedestrian - Walking/Hiking/Running', 'Wildlife Observation']"
Nancy Dillard Lyon,Suburban,Texas,,[],1.80 Miles / 2.90 Km,"['Dogs - On leash', 'Pedestrian - Walking/Hiking/Running', 'Bicycling (off pavement)', 'Bicycling (on pavement)', 'Roller/Inline Skating', 'Wildlife Observation']"
Nassau- Suffolk Greenbelt,Suburban,New York,"Nassau, Suffolk",[],22.00 Miles / 35.41 Km,"['Bicycling (off pavement)', 'Dogs - On leash', 'Fishing', 'Pedestrian - Walking/Hiking/Running', 'Snow - Cross-country Skiing', 'Wildlife Observation']"
Natural Bridge,,Kentucky,,[],0.50 Miles / 0.80 Km,[]
Nature Coast State Trail,"The rail trail is located in the Nature Coast Region of Florida.  West of Gainesville, the trail connects the communities. Rail trail connecting Cross City east to Trenton and Chiefland.<br/>",Florida,"Dixie, Gilchrist, Levy","['Rail', 'Trail']",31.70 Miles / 51.02 Km,"['Bicycling (on pavement)', 'Dogs - On leash', 'Pedestrian - Walking/Hiking/Running', 'Roller/Inline Skating']"
Nelson Ridge NRT 186,"Avery, ID, In Clearwater National Forest at Avery, south of Interstate 90.",Idaho,Shoshone,['Backcountry'],9.30 Miles / 14.97 Km,"['Bicycling (on pavement)', 'Camping', 'Camping', 'Dogs - On leash', 'Equestrian - Riding', 'Motorized vehicles - Motorcycling', 'Pedestrian - Walking/Hiking/Running', 'Snow - Snowshoeing', 'Wildlife Observation']"
New Haven &amp; Northampton Canal Rail Trail (Northampton Section),"Northampton, Massachusetts",Massachusetts,Hampshire,"['Greenway', 'Rail', 'Trail']",4.00 Miles / 6.44 Km,"['Bicycling (on pavement)', 'Dogs - On leash', 'Fishing', 'Heritage and History', 'Pedestrian - Walking/Hiking/Running', 'Roller/Inline Skating', 'Skateboarding', 'Snow - Cross-country Skiing']"
Nez Perce - Nee Me Poo,In Hell’s Canyon National Recreation Area NE of Imnaha. Trail descends to Dug Bar on the Snake River.,Oregon,Wallowa,['Backcountry'],5.00 Miles / 8.05 Km,"['Camping', 'Dogs - On leash', 'Pedestrian - Walking/Hiking/Running']"
Noble Canyon,The Noble Canyon National Recreation Trail begins along Pine Creek Road north of the community of Pine Valley.  It terminates at the Pacific Crest Trail near Oasis Spring in the Laguna Mountain Recreation Area.<break><break>The 10 mile trail ranges in ele</break></break>,California,San Diego,['Backcountry'],10.00 Miles / 16.09 Km,"['Bicycling (on pavement)', 'Bicycling (off pavement)', 'Camping', 'Dogs - On leash', 'Equestrian - Riding', 'Equestrian - Other stock', 'Fishing', 'Pedestrian - Walking/Hiking/Running', 'Snow - Cross-country Skiing', 'Snow - Snow Play, General', 'Snow - Snowshoeing', 'Wildlife Observation']"
North Augusta Greeneway,"North Augusta, SC,  In downtown North Augusta along Savannah River.<br/>",South Carolina,Aiken,"['Greenway', 'Rail', 'Trail']",22.20 Miles / 35.73 Km,"['Bicycling (on pavement)', 'Dogs - On leash', 'Heritage and History', 'Pedestrian - Walking/Hiking/Running', 'Roller/Inline Skating', 'Skateboarding', 'Wildlife Observation']"
North Bend Rail Trail,From I-77 near Parkersburg in Wood County to Wolf Summit in Harrison County,West Virginia,"Wood, Harrison","['Rail', 'Trail']",72.00 Miles / 115.87 Km,"['Bicycling (off pavement)', 'Equestrian - Riding', 'Equestrian - Pack trips', 'Pedestrian - Walking/Hiking/Running']"
North Eastern State Trail (NEST),"A 71 mile state rail-trail that connects Alpena, Michigan to Cheboygan, Michigan.",Michigan,"Cheboygan, Presque Isle, and Alpena","['Rail', 'Trail']",71.00 Miles / 114.26 Km,"['Bicycling (off pavement)', 'Dogs - Mushing', 'Dogs - On leash', 'Equestrian - Riding', 'Equestrian - Pack trips', 'Fishing', 'Heritage and History', 'Motorized vehicles - Snowmobiling', 'Pedestrian - Walking/Hiking/Running', 'Snow - Cross-country Skiing', 'Snow - Snowshoeing', 'Wildlife Observation']"
North Fork John Day,"North Fork John Day Ranger District, Umatilla National Forest",Oregon,"Umatilla, Grant",[],22.90 Miles / 36.85 Km,"['Camping', 'Caving', 'Dogs - Mushing', 'Dogs - On leash', 'Equestrian - Riding', 'Equestrian - Pack trips', 'Equestrian - Other stock', 'Fishing', 'Pedestrian - Walking/Hiking/Running', 'Snow - Cross-country Skiing', 'Snow - Snowshoeing', 'Swimming', 'Wildlife Observation']"
North Mountain Trail,"In Phoenix, in North Mountain Park, near 7th and Dunlap Sts.",Arizona,,[],0.90 Miles / 1.45 Km,[]
North Shore,"Rural, In the San Bernardino National Forest, along N shore of Lake Arrowhead, 10 mi. N of San Bernardino.",California,San Bernardino,['Backcountry'],6.00 Miles / 9.66 Km,"['Bicycling (on pavement)', 'Bicycling (off pavement)', 'Camping', 'Dogs - On leash', 'Equestrian - Riding', 'Pedestrian - Walking/Hiking/Running', 'Roller/Inline Skating', 'Snow - Cross-country Skiing', 'Snow - Snowshoeing']"
North Umpqua - Maidu Lake Segment,"Diamond Lake Ranger District, Umpqua National Forest.",Oregon,"Douglas, Klamath",['Backcountry'],9.00 Miles / 14.48 Km,"['Camping', 'Dogs - On leash', 'Equestrian - Riding', 'Equestrian - Pack trips', 'Equestrian - Other stock', 'Fishing', 'Pedestrian - Walking/Hiking/Running', 'Snow - Cross-country Skiing', 'Snow - Snowshoeing']"
North Umpqua-Tioga Section,"Along Umpqua R near Glide and Idelwyld Park. East of Roseburg, Oregon",Oregon,Douglas,['Backcountry'],11.00 Miles / 17.70 Km,"['Bicycling (off pavement)', 'Camping', 'Dogs - On leash', 'Equestrian - Riding', 'Fishing', 'Pedestrian - Walking/Hiking/Running']"
Northfield Mountain,"Rural, off route 63.","Connecticut, Massachusetts",,[],33.00 Miles / 53.11 Km,"['Bicycling (on pavement)', 'Camping', 'Camping', 'Dogs - On leash', 'Equestrian - Riding', 'Pedestrian - Walking/Hiking/Running', 'Snow - Cross-country Skiing']"
Northwest Greenway Trail,West Lafayette,Indiana,Tippecanoe,[],5.00 Miles / 8.05 Km,[]
Oak Leaf Trail – Lake Loop,,Wisconsin,Milwaukee,"['Fitness', 'Trail', 'Urban', 'Trail']",3.10 Miles / 4.99 Km,"['Bicycling (on pavement)', 'Pedestrian - Walking/Hiking/Running', 'Roller/Inline Skating']"
Oak Mountain Red Trail,"Oak Mountain State Park near Birmingham, AL",Alabama,Shelby,"['Mountain', 'Bike', 'Trail', 'Nature', 'Trail']",25.00 Miles / 40.23 Km,"['Bicycling (off pavement)', 'Dogs - On leash', 'Pedestrian - Walking/Hiking/Running']"
Oaks to Wetlands Trail,"Ridgefield National Wildlife Refuge, Carty Unit, near Ridgefield, WA<br/>",Washington,Clark,[],2.00 Miles / 3.22 Km,"['Fishing', 'Pedestrian - Walking/Hiking/Running', 'Wildlife Observation']"
Observatory,"In Cleveland National Forest, off County Hwy. S6, connects Observatory campground to Mount Palomar Observatory.",California,San Diego,[],2.10 Miles / 3.38 Km,[]
Ohio &amp; Erie Canal Towpath Trail,"The Towpath Trail begins in Cleveland, north of Harvard Road, travels, through Cleveland Metroparks, Cuyahoga Valley National Park, Metroparks, Serving Summit County, through the remainder of Summit County,  and ends in Tuscarawas County.",Ohio,"Cuyahoga, Summit, Tuscarawas","['Fitness', 'Trail', 'Greenway', 'Nature', 'Trail']",59.00 Miles / 94.95 Km,"['Bicycling (off pavement)', 'Dogs - On leash', 'Pedestrian - Walking/Hiking/Running', 'Snow - Cross-country Skiing', 'Snow - Snowshoeing', 'Wildlife Observation']"
Oil Creek State Park Multi-Use Trail,"Oil Creek State Park, Oil City, PA",Pennsylvania,Venango,"['Greenway', 'Rail', 'Trail']",9.70 Miles / 15.61 Km,"['Bicycling (on pavement)', 'Dogs - On leash', 'Heritage and History', 'Hunting', 'Pedestrian - Walking/Hiking/Running', 'Snow - Cross-country Skiing', 'Snow - Snowshoeing']"
Old Baldy Super Loop,In Coronado National Forest near Madera Canyon.,Arizona,,[],12.90 Miles / 20.76 Km,[]
Old Growth Ridge,From Eugene W on SR 126 50 mi. to Siuslaw River Access Rd.  Turn S 2 mi. to Whittaker Creek Campground.,Oregon,Lane,['Backcountry'],1.50 Miles / 2.41 Km,"['Boating, non-motorized: Rafting', 'Camping', 'Pedestrian - Walking/Hiking/Running', 'Swimming', 'Wildlife Observation']"
Old Oak,"At Lake Metigoshi SP, 13 mi. N of Bottineau.",North Dakota,Bottineau,"['Nature', 'Trail']",3.00 Miles / 4.83 Km,"['Bicycling (off pavement)', 'Camping', 'Dogs - On leash', 'Pedestrian - Walking/Hiking/Running', 'Snow - Cross-country Skiing', 'Snow - Snowshoeing', 'Swimming', 'Wildlife Observation']"
Olentangy/Scioto,Urban,Ohio,,[],13.50 Miles / 21.73 Km,"['Dogs - On leash', 'Pedestrian - Walking/Hiking/Running', 'Bicycling (on pavement)', 'Roller/Inline Skating', 'Snow - Cross-country Skiing', 'Wildlife Observation']"
Oregon High Desert Trail,"In the Steens Mountains, Southeastern Oregon",Oregon,Harney,['Backcountry'],150.00 Miles / 241.40 Km,['Pedestrian - Walking/Hiking/Running']
Otispike Wilderness Nature,At Fire Island Nat. Seashore at Smith Point Visitor Contact Station.,New York,,[],0.80 Miles / 1.29 Km,[]
Ouachita Geo-Float Trail,"Rural, At Lake Ouachita NW of Hot Springs<br/>
GPS coordinates for first ""stop"" on Geo Float Trail are: 34.58945N/093.22230W",Arkansas,Garland,"['Water', 'Trail']",16.00 Miles / 25.75 Km,"['Boating, Motorized', 'Boating, non-motorized: Canoeing', 'Boating, non-motorized: Kayaking', 'Boating, non-motorized: Rafting', 'Boating, non-motorized: Sailing', 'Fishing', 'Swimming', 'Swimming - Diving/snorkeling', 'Wildlife Observation']"
